id,id,dialogue,summary
13729106-1,13729106-1,"Jill: So bored!
Nate: Well... can't help you there
Nate: Still at work
Jill: ugh I need to find a job
Jill: I've watched everything on youtube already
Nate: Doubt it :P I'll call you when I get off work",Jill needs to find a job.
13716120,13716120,"Madison: <file_other>
Madison: I saw this offer today
Adam: Thailand??
Madison: Exactly
Adam: Not to expensive??
Madison: Tickets cost pretty penny, but the rest is extra cheap
Taylor: And children under 12 --> 50% off
Jordan: Seems ok",Madison has found an offer for Thailand.
13682034,13682034,"Danna: How's your Saturday?
Reed: It was alright thanks
Danna: Good
Reed: Yours ?
Danna: Boring
Reed: Why?
Danna: I'm angry I called maybe 5-8 of my friends and they aren't around or are busy.
Reed: Shame
Danna: So it's is the next boring weekend for me
Reed: That sucks
Danna: The only thing I can do is watching TV -.-
Reed: Haha lucky you
Danna: Yeah haha
Reed: I don't have tv, our subscription expired and they never renewed it. They want us to pay for it so fuck it
Danna: Yeah. What are you doing?
Reed: I'm in bed
Danna: Work tomorrow?
Reed: No. Off tomorrow
Danna: Nice
Reed: Indeed","Reed's Saturday was alright. Danna's was boring, she called about 5 of her friends, but nobody picked up."
13814648,13814648,"Alexa: I want to confess something
Hunter: What is it?
Alexa: I asked Ethan to Insult you :(
Hunter: But why did you do that?
Alexa: I was too jealous to see you with Ethan that day, dats why :(
Hunter: But you could just ask me not to do something if you dont want me to?
Alexa: We would talk about it tomorrow",Alexa asked Ethan to Insult Hunter. She was jealous when she saw Hunter with Ethan.
13717250,13717250,"Johnatan: yoo guys
Darren: B-)
Lucas: hey wassup
Johnatan: beer? now?
Darren: hell yeah B-)
Lucas: I'm free in the evening","Johnatan, Darren and Lucas will have a beer in the evening."
13863202,13863202,"Kristian: Adidas Or Nike?😃
Tabora: Adidas(＾ｖ＾)
Kristian: Watermelon or orange?😃😃
Tabora: Orange(＾ｖ＾)
Kristian: Superman or batman?😃😃😃
Tabora: Batman(＾ｖ＾)
Tabora: What are we doing now?
Kristian: Just playing games😃😃😃😃
Kristian: Wanna keep going?😃
Tabora: Sure! It is kinda fun!(*^0^*)
Kristian: Films or books?😃😃😀😀😀😀😀😀
Tabora: Films!(＾ｖ＾)
Tabora: When is my turn?",Kristian: Superman or Batman? Tabora: Batman. 
13819098,13819098,"Claire: Check this out :)))
Claire: <file_other>
Maria: !!
Nicole: Absolutely perfect for you!!
Claire: I guess so
Claire: But it could be a bit darker, cause this color is not very vivid
Nicole: Noooooo, I think this color is perfectly good for the bride
Maria: And it's no that expensive :)))
Claire: Yes, the price appeals to me xD
Nicole: You should order that dress
Nicole: I think you won't regret
Maria: Don't hesitate, it's incredibly beauty!!
Claire: Ok, if you say so :))","Claire sent Maria and Nicole a photo of herself in a dress that she found on the Internet. Maria and Nicole liked the dress, but Claire wanted it to be a bit darker."
13682188,13682188,"Ty: do you speak French?
Veronica: no 
Ty: pity, I need a translator ",Veronica doesn't speak French. Ty needs a translator.
13716051,13716051,"Inez: My dears, our evening inspired me to create this group conversation to plan further Food Evenings :)
Inez: This is my proposal for the next one: <file_photo>
Alicja: Wow, I will actually feel happy going to work thanks to this :D
Gosia: Happy going to work and even happier leaving it haha
Alicja: Just too bad that the time between 9 and 17 will be wasted :P
Patrycja: I really liked our evening, even the pizza was delicious :) How did you girls like it?
Inez: I loved it, Gosia really chose a great place :)
Gosia: I am an expert at eating :D
Alicja: Have you been to this restaurant Inez sent?
Gosia: No, it is quite new. But I heard good opinions! :D
Patrycja: And it fits with our theme of exploring world cuisines :)
Alicja: First Italy, now Korea! :D
Inez: So when could we do this again?
Gosia: I am not sure, but we have to before the holidays!
Patrycja: We should have less work in two weeks, we could go again on Wednesday?
Alicja: Sounds good to me!
Inez: Me too :D",Inez wants to organise further Food Evenings. Alicja and Ivan are interested in joining.
13681870,13681870,"Miley: don't want to go to work tomorrow!
Miley: wanna sleep!!!
Miley: need some rest :(
Aaron: know what u feelin
Aaron: really want some holiday already
Miley: :(
Aaron: fighting girl!",Miley and Aaron are tired of work. 
13680843,13680843,"Ann: hello Katie, thank you so much for hosting Tim monday evening and for dropping him at the railway station next morning. Here is mobile number... .I 'll confirm you , but again and in advance: thanks a lot
Katie: Hello Ann, i didn't realise but we spend a week end together 20 years ago in Saint Fargeau!!!
Ann: it goes back so long... but it's possible
Ann: It's true that i know Ben since school.
Katie: as far as i'm concern i remember very well this week end as i had a very good friends call Ann Cairns ( like you)😜, Erik's wife
Ann: Erik's wife? of course he's my cousin, and Ann his wife is the cousin of one of my best friend... Small word
Katie: indeed
Ann: Hi Katie, is it still ok for hosting my son tomorrow? You may send him a text to tell him where you want to pick him up. Thanks so much
Katie: Yes Ann, i'll send a text to your son for tomorrow.
Ann: Thanks. Funny you also know Stef and Leo, friends of us in Berlin. But it's true they lived in Reims before
Katie: your son is really nice. don't hesitate to contact me again if needed.",Ann thanks Katie for hosting Tim on Monday and dropping him off at the railway station the next morning. Ann sends Katie her mobile number so that she can confirm the arrangement.
13730619,13730619,"Jack: Can you buy butter?
Thomas: Sure
Jack: Thanks. When are you coming home?
Thomas: I'm on my way
Jack: Ok, I'll wait with cooking until you come
Thomas: What are you making?
Jack: A mushroom soup.
Thomas: Tasty!",Thomas is buying butter for Jack. Jack is making a meal.
